
T:  Bus=01 Lev=00 Prnt=00 Port=00 Cnt=00 Dev#=  1 Spd=480  MxCh=12
D:  Ver= 2.00 Cls=09(hub  ) Sub=00 Prot=01 MxPS=64 #Cfgs=  1
P:  Vendor=1d6b ProdID=0002 Rev=06.17
S:  Manufacturer=Linux 6.17.8-arch1-1 xhci-hcd
S:  Product=xHCI Host Controller
S:  SerialNumber=0000:00:14.0
C:  #Ifs= 1 Cfg#= 1 Atr=e0 MxPwr=0mA
I:  If#= 0 Alt= 0 #EPs= 1 Cls=09(hub  ) Sub=00 Prot=00 Driver=hub
E:  Ad=81(I) Atr=03(Int.) MxPS=   4 Ivl=256ms

T:  Bus=01 Lev=01 Prnt=01 Port=00 Cnt=01 Dev#=  2 Spd=12   MxCh= 0
D:  Ver= 1.10 Cls=e0(wlcon) Sub=01 Prot=01 MxPS=64 #Cfgs=  1
P:  Vendor=2357 ProdID=0604 Rev=02.00
S:  Manufacturer= 
S:  Product=TP-Link UB500 Adapter
S:  SerialNumber=E848B8C82000
C:  #Ifs= 2 Cfg#= 1 Atr=e0 MxPwr=500mA
I:  If#= 0 Alt= 0 #EPs= 3 Cls=e0(wlcon) Sub=01 Prot=01 Driver=btusb
E:  Ad=02(O) Atr=02(Bulk) MxPS=  64 Ivl=0ms
E:  Ad=81(I) Atr=03(Int.) MxPS=  16 Ivl=1ms
E:  Ad=82(I) Atr=02(Bulk) MxPS=  64 Ivl=0ms
I:  If#= 1 Alt= 0 #EPs= 2 Cls=e0(wlcon) Sub=01 Prot=01 Driver=btusb
E:  Ad=03(O) Atr=01(Isoc) MxPS=   0 Ivl=1ms
E:  Ad=83(I) Atr=01(Isoc) MxPS=   0 Ivl=1ms

T:  Bus=01 Lev=01 Prnt=01 Port=02 Cnt=02 Dev#=  3 Spd=480  MxCh= 0
D:  Ver= 2.10 Cls=00(>ifc ) Sub=00 Prot=00 MxPS=64 #Cfgs=  1
P:  Vendor=2357 ProdID=011e Rev=02.00
S:  Manufacturer=Realtek 
S:  Product=802.11ac WLAN Adapter 
S:  SerialNumber=00e04c000001
C:  #Ifs= 1 Cfg#= 1 Atr=e0 MxPwr=500mA
I:  If#= 0 Alt= 0 #EPs= 6 Cls=ff(vend.) Sub=ff Prot=ff Driver=rtw_8821au
E:  Ad=05(O) Atr=02(Bulk) MxPS= 512 Ivl=0ms
E:  Ad=06(O) Atr=02(Bulk) MxPS= 512 Ivl=0ms
E:  Ad=08(O) Atr=02(Bulk) MxPS= 512 Ivl=0ms
E:  Ad=09(O) Atr=02(Bulk) MxPS= 512 Ivl=0ms
E:  Ad=84(I) Atr=02(Bulk) MxPS= 512 Ivl=0ms
E:  Ad=87(I) Atr=03(Int.) MxPS=  64 Ivl=500us

T:  Bus=01 Lev=01 Prnt=01 Port=03 Cnt=03 Dev#=  4 Spd=12   MxCh= 0
D:  Ver= 2.00 Cls=ff(vend.) Sub=01 Prot=01 MxPS=64 #Cfgs=  1
P:  Vendor=0a5c ProdID=216d Rev=01.12
S:  Manufacturer=Broadcom Corp
S:  Product=BCM43142A0
S:  SerialNumber=D85DE2C7D3AC
C:  #Ifs= 0 Cfg#= 0 Atr= MxPwr=
I:  If#= 0 Alt= 0 #EPs= 6 Cls=ff(vend.) Sub=ff Prot=ff Driver=(none)

T:  Bus=01 Lev=01 Prnt=01 Port=04 Cnt=04 Dev#=  5 Spd=480  MxCh= 0
D:  Ver= 2.00 Cls=ef(misc ) Sub=02 Prot=01 MxPS=64 #Cfgs=  1
P:  Vendor=04f2 ProdID=b509 Rev=28.74
S:  Manufacturer=SunplusIT Inc
S:  Product=HP Truevision HD
C:  #Ifs= 2 Cfg#= 1 Atr=80 MxPwr=500mA
I:  If#= 0 Alt= 0 #EPs= 1 Cls=0e(video) Sub=01 Prot=00 Driver=uvcvideo
E:  Ad=87(I) Atr=03(Int.) MxPS=  16 Ivl=16ms
I:  If#= 1 Alt= 0 #EPs= 0 Cls=0e(video) Sub=02 Prot=00 Driver=uvcvideo

T:  Bus=02 Lev=00 Prnt=00 Port=00 Cnt=00 Dev#=  1 Spd=5000 MxCh= 6
D:  Ver= 3.00 Cls=09(hub  ) Sub=00 Prot=03 MxPS= 9 #Cfgs=  1
P:  Vendor=1d6b ProdID=0003 Rev=06.17
S:  Manufacturer=Linux 6.17.8-arch1-1 xhci-hcd
S:  Product=xHCI Host Controller
S:  SerialNumber=0000:00:14.0
C:  #Ifs= 1 Cfg#= 1 Atr=e0 MxPwr=0mA
I:  If#= 0 Alt= 0 #EPs= 1 Cls=09(hub  ) Sub=00 Prot=00 Driver=hub
E:  Ad=81(I) Atr=03(Int.) MxPS=   4 Ivl=256ms
